Key,Description,Standard,GER,KOR
SAY.FinalStage.1.Alice,,Thank you for your efforts.,Danke für Ihre Bemühungen.,당신의 노력에 감사드립니다.
SAY.FinalStage.2.Alice,,I'm thinking of holding an event for the guests who have come so far.,"Ich denke darüber nach, eine Veranstaltung für die Gäste abhalten, die bisher gekommen sind.",지금까지 와 주신 손님들을위한 이벤트를 진행할까 생각 중입니다.
SAY.FinalStage.3.Alice,,What do you think?,Was denken Sie?,어떻게 생각하세요?
MENU.FinalStage.4,,That's good.,Das ist gut.,좋아요.
MENU.FinalStage.5,,It doesn't look good.,Es sieht nicht gut aus.,좋아 보이지 않습니다.
MENU.FinalStage.6,,I don't know,Ich weiß es nicht,모르겠네요.
SAY.FinalStage.14.Alice,,Well..,Gut...,음..
SAY.FinalStage.15.Alice,,"Still, how about doing it for the guests?",Aber wie wäre es damit für die Gäste?,그래도 손님들을 위해 하는 건 어떤가요?
MENU.FinalStage.16,,That's good.,Das ist gut.,좋아요.
MENU.FinalStage.17,,I don't know,Ich weiß es nicht,모르겠네요.
SAY.FinalStage.18.Alice,,"If you're not sure,","Wenn Sie sich nicht sicher sind,","모르시겠다면, "
SAY.FinalStage.20.Alice,,why don't you listen to me and give it a try?,Warum hörst du mir nicht zu und probiert es aus?,제 말 한 번 들어보시는게 어떤가요?
MENU.FinalStage.21,,That's good.,Das ist gut.,좋아요.
SAY.FinalStage.9.Alice,,I knew you'd say that.,"Ich wusste, dass du das sagen würdest.",당신이 그렇게 말할 줄 알았어요.
SAY.FinalStage.10.Alice,,Wait a moment. I'll prepare for the event quickly.,Moment mal. Ich werde mich schnell auf die Veranstaltung vorbereiten.,잠시만요. 빨리 이벤트를 준비하겠습니다.
SAY.FinalStage.11.Alice,,It's done. Let's get started!,Es ist fertig. Lass uns anfangen!,준비 끝났습니다. 시작해보죠!
SAY.FinalStage.27.,,"After the event,","Nach dem Ereignis,","이벤트 후,"
SAY.FinalStage.28.,,I am going to go on vacation for the first time since the cafe opened.,Ich werde zum ersten Mal seit Eröffnung des Cafés Urlaub machen.,카페 오픈 이후 처음으로 휴가를 떠날 예정이다.
SAY.FinalStage.29.,,What should I do?,Was sollte ich tun?,어떻게 해야 할까?
MENU.FinalStage.34,,Visit Sherlock's house,Besuchen Sie Sherlocks Haus,셜록의 집 방문
MENU.FinalStage.37,,Playing with Annie,Mit Annie spielen,애니와 함께 놀기
MENU.FinalStage.40,,Take a plane with Trevor.,Nehmen Sie ein Flugzeug mit Trevor.,트레버와 같이 비행기 타기
SAY.FinalStage.60.,,221B Baker Street... is it here?,221B Baker Street ... ist es hier?,베이커가 221B번지… 여긴가?
SAY.FinalStage.61.,,"Sherlock, it's me.","Sherlock, ich bin es.","셜록, 나야."
SAY.FinalStage.63.,,I'm here to talk to you.,"Ich bin hier, um mit dir zu reden.",같이 얘기하려고 왔어
SAY.FinalStage.64.,,Have an espresso!,Trinken Sie einen Espresso!,에스프레소를 가지고!
SAY.FinalStage.65.Sherlock,,"Oh, look who it is.","Oh, schau wer es ist.","오, 이게 누구야."
SAY.FinalStage.66.Sherlock,,"Nice friend, and nice espresso.",Netter Freund und schöner Espresso.,반가운 친구와 반가운 에스프레소군.
SAY.FinalStage.67.Sherlock,,Welcome!,herzlich willkommen!,어서오게!
SAY.FinalStage.68.Sherlock,,"John, look who's here!","John, schau wer hier ist!","존, 누가 왔는지 봐봐!"
SAY.FinalStage.87.John,,Who is it?,Wer ist es?,누가 왔어?
SAY.FinalStage.74.Sherlock,,"The cafe friend I always told you about,","Der Cafe-Freund, von dem ich dir immer erzählt habe,","늘 말했던 카페 친구,"
SAY.FinalStage.75.Sherlock,,this espresso tastes amazing!,Dieser Espresso schmeckt unglaublich!,이 에스프레소는 진짜 맛있다고!
SAY.FinalStage.89.John,,"Oh yes, nice to meet you.","Oh ja, schön dich zu treffen.","그렇군, 만나서 반갑습니다."
SAY.FinalStage.90.John,,Finally I will try this espresso too.,Zum Schluss werde ich auch diesen Espresso probieren.,"드디어, 이 에스프레소를 먹어보는구만"
SAY.FinalStage.93.John,,I can't wait any longer.,Ich kann es kaum erwarten,"참을 수 없어,"
SAY.FinalStage.78.Sherlock,,"Come on, sit down.","Komm schon, setz dich.","어서, 앉아."
SAY.FinalStage.94.John,,Give me the espresso.,Gib mir den Espresso.,에스프레소 주세요.
SAY.FinalStage.79.John,,I'll pour it into the cup.,Ich werde es in die Tasse gießen.,컵에 따라 올게요.
SAY.FinalStage.82.Sherlock,,"Oh, okay, okay.","Oh, okay, okay.","어, 그래 그래"
SAY.FinalStage.95.Sherlock,,"By the way, my new case was very complicated.",Mein neuer Fall war übrigens sehr kompliziert.,"그건 그렇고, 이번에 내가 새로 맡은 사건, 진짜 복잡했다니깐."
SAY.FinalStage.83.Sherlock,,What it was...,Was es war...,그게 뭐나면…
SAY.FinalStage.86.Sherlock,,"Before that, can you tell me the secret of espresso?",Können Sie mir vorher das Geheimnis des Espressos verraten?,그 전에 에스프레소 비결좀 말해 줄 수 있어?
SAY.FinalStage.97.Sherlock,,I'm really curious.,Ich bin wirklich neugierig.,진짜 궁금하거든.
SAY.FinalStage.100.???,,Who is it?,Wer ist es?,누구시죠?
SAY.FinalStage.101.,,I'm here to see Trevor with toast,"Ich bin hier, um Trevor mit Toast zu sehen.",트레버 보러왔습니다. 토스트 가지고요.
SAY.FinalStage.102.???,,"Oh, you're the owner of a cafe.","Oh, du bist der Besitzer eines Cafés.","오, 카페 사장님이시군요."
SAY.FinalStage.103.???,,I'm always eating well.,Ich esse immer gut.,항상 잘 먹고 있습니다.
SAY.FinalStage.104.???,,"Trevor, we have a visitor.","Trevor, wir haben einen Besucher.","트레버, 손님이 왔어."
SAY.FinalStage.105.Trevor,,"Oh, you're here, with Toast!","Oh, du bist hier mit Toast!","오, 오셨군요! 토스트랑 같이."
SAY.FinalStage.107.Trevor,,Thank you.,Danke,감사합니다.
SAY.FinalStage.108.Trevor,,"Oh, yes. Are you ready to take the plane?","Oh ja. Bist du bereit, das Flugzeug zu nehmen?","아, 비행기를 탈 준비가 되셨나요?"
SAY.FinalStage.131.Trevor,,How much do I spin?,Wie viel spinne ich?,얼마나 회전할까요?
MENU.FinalStage.130,,Once,Einmal,한 번
MENU.FinalStage.133,,Twice,zweimal,두 번
MENU.FinalStage.132,,As much as possible,So viel wie möglich,가능한 많이!
SAY.FinalStage.173.,,"Annie, let's go play where you said before.","Annie, lass uns spielen gehen, wo du es vorher gesagt hast.","애니, 전에 말한대로 놀자."
SAY.FinalStage.174.Annie,,Oh yeah! Let's go right away!,Oh ja! Lass uns sofort gehen!,오 예! 당장 가자!
SAY.FinalStage.179.Annie,,look!!,aussehen!!,봐봐!
SAY.FinalStage.183.Annie,,It's my secret place!,Es ist mein geheimer Ort!,내 비밀 장소야!
SAY.FinalStage.184.Annie,,Welcome!,Herzlich willkommen!,어서와!
SAY.FinalStage.182.Annie,,"Look up and down, how is it??","Schau auf und ab, wie ist es?","위 아래로 봐봐, 어때 ??"
SAY.FinalStage.186.Annie,,"Look at the waterfalls, trees and moss!\nThere are even a lot of fish!!","Schau dir die Wasserfälle, Bäume und Moos an! Es gibt sogar viele Fische !!","폭포, 나무, 이끼를 봐봐! 물고기도 많이있다고!!"
SAY.FinalStage.193.Annie,,Shall we go over there and play?,Sollen wir dorthin gehen und spielen?,우리 저기 가서 놀아볼까?
SAY.FinalStage.195.Annie,,(I took out the donut and gave it to Annie),(Ich nahm den Donut heraus und gab ihn Annie),(도넛을 꺼내서 애니에게 주었다)
SAY.FinalStage.196.Annie,,(Eating a donut) This donut is delicious anytime!,(Donut essen) Dieser Donut ist jederzeit lecker!,(도넛을 먹으면서) 이 도넛은 언제먹어도 맛있다니깐!
SAY.FinalStage.197.Annie,,It's really nice to come to play\nI feel healed,"Es ist wirklich schön, zum Spielen zu kommen. Ich fühle mich geheilt",여기 와서 노니까 정말 좋다. 힐링되는 느낌이야.
SAY.FinalStage.198.,,"Afterwards, on every vacation,","Danach in jedem Urlaub,","그 후, 휴가 때마다"
SAY.FinalStage.199.,,"Plays with Annie in her secret place, eating donuts.",Spielt mit Annie an ihrem geheimen Ort und isst Donuts.,"애니와 함께 그녀의 비밀 장소에서 놀곤 한다, 도넛을 먹으면서.."
SAY.FinalStage.135.Trevor,,"Now, Let's go!",Jetzt aber los!,"자, 갑니다!"
SAY.FinalStage.136.Trevor,,"Now, Let's go!",Jetzt aber los!,"자, 갑니다!"
SAY.FinalStage.137.Trevor,,"Now, Let's go!",Jetzt aber los!,"자, 갑니다!"
SAY.FinalStage.170.Trevor,,Hold tight!,Halt dich fest!,꽉 잡으세요!
SAY.FinalStage.161.Trevor,,Wow!!!,Beeindruckend!!,와우!
SAY.FinalStage.162.Trevor,,Isn't it interesting?,Ist es nicht interessant?,흥미롭지 않으신가요?
SAY.FinalStage.163.Trevor,,This moment is the most interesting and enjoyable for me.,Dieser Moment ist der interessanteste und angenehmste für mich.,저는 이 순간이 가장 흥미롭고 즐겁습니다.
SAY.FinalStage.164.Trevor,,That's why I became a pilot.,Deshalb bin ich Pilot geworden.,제가 파일럿이 된 이유기도 하죠.
SAY.FinalStage.165.Trevor,,Let's forget everything today!,Vergessen wir heute alles!,오늘은 모든 일을 다 잊어 버리죠!!
SAY.FinalStage.167.,,It was an air show that was thrilling enough to forget everything about the cafe.,"Es war eine Flugshow, die aufregend genug war, um alles über das Café zu vergessen.",카페에 대한 모든 것을 잊을만큼 스릴 넘치는 에어쇼였다.
SAY.FinalStage.168.,,"After that, I would sometimes go to Trevor.",Danach ging ich manchmal nach Trevor.,"그 후, 나는 가끔 트레버에게 가곤 한다…"
SAY.FinalStage.211.,,I think I'm crazy about my café.,"Ich glaube, ich bin in das Café vertieft.",아무래도 나는 내 카페에 푹 빠진 것 같다.
SAY.FinalStage.212.,,Let's open a cafe for guests!,Öffnen Sie ein Café für die Gäste!,손님들을 위해 카페를 열자!
SAY.FinalStage.221.,,"Sherlock, espresso.","Sherlock, Espresso.","셜록, 에스프레소"
SAY.FinalStage.224.Sherlock,,"Thank you, always",Ich danke Ihnen immer.,항상 고맙군.
SAY.FinalStage.227.,,"Here's the toast, Mr. Trevor.","Toast, Mr.Trevor.","토스트 나왔습니다, 트레버씨"
SAY.FinalStage.228.Trevor,,"Thank you, so much.",Vielen Dank.,감사합니다!
SAY.FinalStage.231.,,"Here's a donut, my little friend.","Donuts sind da, Kumpel!","도넛 나왔어, 친구!"
SAY.FinalStage.233.Annie,,Thanks!!,Danke!,고마워!
SAY.FinalStage.237.,,I'm spending my day as usual today. ,Heute verbringe ich einen Tag wie üblich. ,오늘도 평소와 다름없는 하루를 보냈다.
SAY.FinalStage.238.,,This kind of day is not bad either.,Heute ist es nicht schlecht.,이런 날도 나쁘진 않은 것 같다.
SAY.FinalStage.239.,,How will I be in a few years?,Was passiert mit mir in ein paar Jahren?,몇 년 후에 나는 어떻게 되어 있을까?
SAY.FinalStage.240.,,Do I still run a cafe?,Führt ich immer noch ein Café?,여전히 카페를 운영하고 있을까?
SAY.FinalStage.241.,,Or am I living a different life?,Oder soll ich ein anderes Leben führen?,아니면 다른 삶을 살고 있을까?
SAY.FinalStage.242.,,No one knows.,Niemand weiß es.,아무도 모른다.
SAY.FinalStage.243.,,The second act of my life has just begun..,Der zweite Akt meines Lebens hat gerade angefangen..,내 인생의 2막은 이제 막 시작되었으니까..
CHARACTER.John,,John,John,존
CHARACTER.Alice,,Alice,Alice,엘리스
CHARACTER.???,,???,???,???
CHARACTER.Annie,,Annie,Annie,애니
CHARACTER.Sherlock,,Sherlock,Sherlock,셜록
CHARACTER.Trevor,,Trevor,Trevor,트레버
MENU.FinalStage.209,,Open a cafe for guests.,Café für die Gäste eröffnen,손님들을 위해 카페 열기
